FoodItem,calories,amount,unit,ingrediant,meal_time,recepie
Gajar Halwa,120,1,cup,"Carrots, Milk, Sugar, Ghee, Cardamom",Dessert,"Grate carrots and cook them in ghee until they soften;
Add milk, sugar, and cardamom to the carrots;
Cook the mixture until it thickens and attains a halwa consistency."
Papdi Chaat,120,1,plate,"Papdis, Chickpeas, Potatoes, Yogurt, Tamarind Chutney",Snack,"Prepare crisp fried dough wafers (papdi);
Boil and chop potatoes; mix with spices;
Arrange papdi on a plate; top with boiled potatoes, yogurt, chutneys, and spices."
Malai Kofta,120,1,cup,"Cottage Cheese, Onion, Tomato, Cream, Cashews, Garam Masala",Dinner,"Make kofta by mixing paneer, mashed potatoes, and spices;
Shape the mixture into balls and fry until golden brown;
Prepare a creamy tomato-based curry;
Cook the kofta in the curry until they absorb the flavors."
Aloo Tikki,80,1,piece,"Potatoes, Green Peas, Spices",Snack,"Boil and mash potatoes; add spices and mix;
Shape the mixture into patties;
Shallow fry the patties until they are golden brown on both sides."
Chicken Biryani,150,100,gm,"Basmati Rice, Chicken, Onions, Tomatoes, Ghee, Biryani Masala","Lunch, Dinner","Marinate chicken with spices and yogurt;
Partially cook basmati rice;
Layer marinated chicken and partially cooked rice;
Slow-cook until both the chicken and rice are fully cooked."
Fish Curry,150,1,cup,"Fish, Coconut Milk, Onions, Tomatoes, Ginger, Garlic, Garam Masala","Lunch, Dinner","Prepare a spice blend with tomatoes, onions, and coconut milk;
Marinate fish in the spice blend;
Cook the marinated fish until it's tender and flavorful."
Rogan Josh,120,1,cup,"Lamb, Yogurt, Tomatoes, Onions, Kashmiri Red Chili Powder, Ginger, Garlic, Garam Masala",Dinner,"Slow-cook tender meat in a rich tomato-based curry;
Infuse the curry with aromatic spices until the meat is flavorful."
Palak Chicken,120,1,cup,"Chicken, Spinach, Onions, Tomatoes, Ginger, Garlic, Garam Masala",Dinner,"Cook chicken with a puree of spinach and spices until the chicken is done;
Simmer until the curry reaches the desired consistency."
Keema Naan,150,1,piece,"Minced Meat, All-Purpose Flour, Yogurt, Baking Powder, Baking Soda, Ghee","Lunch, Dinner","Combine flour, yeast, yogurt, and spices; form a soft dough; rest the dough, then divide into balls; flatten a ball, add spiced minced meat, seal, and roll it out; cook in a preheated tandoor or oven until golden and puffed."
Chicken Korma,120,1,cup,"Chicken, Cashews, Yogurt, Onion, Tomato, Cream, Ghee, Ginger, Garlic",Dinner,"Marinate chicken in yogurt, cashew paste, and aromatic spices; sauté sliced onions until caramelized; add marinated chicken; cook until the chicken is browned; pour in coconut milk; simmer until the chicken is tender and the sauce thickens."
Chicken Saag,120,1,cup,"Chicken, Coconut Milk, Onions, Tomatoes, Ginger, Garlic, Garam Masala",Dinner,"Sauté chopped onions, ginger, and garlic until golden; add chicken pieces and brown them; blend spinach and mustard greens into a puree; mix the puree into the chicken; simmer until well combined; finish with cream."
Chicken Do Pyaza,120,1,cup,"Basmati Rice, Lamb, Onions, Tomatoes, Ginger, Garlic, Garam Masala",Dinner,"Sauté sliced onions until golden brown; brown chicken; add spices, tomatoes, and yogurt mixture; cook until chicken is tender; garnish and serve."
Chicken Vindaloo,120,1,cup,"Chicken, Onions, Tomatoes, Ghee, Ginger, Garlic, Garam Masala",Dinner,"Marinate chicken in a mixture of vinegar, red chilies, and spices; sauté chopped onions, add marinated chicken, and cook until browned; simmer until the chicken is tender and the sauce is thick."
Hyderabadi Biryani,150,100,gm,"Chicken, Potatoes, Vinegar, Red Chili Powder, Ginger, Garlic, Garam Masala","Lunch, Dinner","Marinate meat; partially cook basmati rice with whole spices; drain; layer marinated meat and partially cooked rice in a heavy-bottomed pot; garnish with fried onions, mint, and coriander; seal the pot and cook on low heat until meat and rice are fully cooked."
Bhuna Gosht,120,1,cup,"Basmati Rice, Chicken, Yogurt, Onions, Tomatoes, Saffron, Ghee, Biryani Masala",Dinner,"Sauté chopped onions, tomatoes, and spices until thickened; add meat and brown it well in the spice mixture; slow-cook until the meat becomes tender and absorbs the flavors; garnish with fresh coriander before serving."
Chicken Malai Tikka,150,1,cup,"Lamb, Onions, Tomatoes, Ginger, Garlic, Garam Masala, Coriander Powder",Dinner,"Marinate chicken in cream, yogurt, and spices; skewer and grill until charred; baste with melted butter or cream for added richness; serve hot with mint chutney."
Nihari,120,1,cup,"Chicken, Cream, Yogurt, Ginger, Garlic, Cashews, Garam Masala",Dinner,"Slow-cook meat with spices, ginger, and garlic until it becomes tender; strain the broth and separate the meat; garnish with fried onions, ginger, and fresh coriander; serve with naan or steamed rice."
Chicken Methi,120,1,cup,"Chicken, Methi (Fenugreek) Leaves, Onions, Tomatoes, Ginger, Garlic, Garam Masala",Dinner,Sauté chopped onions until golden; add chicken pieces and cook until browned; stir in fresh methi (fenugreek) leaves and cook until chicken is done; adjust seasoning and serve hot.
Egg Curry,120,1,cup,"Eggs, Onion, Tomato, Ginger, Garlic, Garam Masala",Dinner,"Sauté chopped onions, tomatoes, and spices until a thick gravy forms; halve or quarter hard-boiled eggs and add to the gravy; simmer until eggs absorb the flavors of the curry; garnish with chopped cilantro and serve hot."
Anda Bhurji,120,1,cup,"Eggs, Onion, Tomato, Green Chilies, Ginger, Garlic, Garam Masala","Breakfast, Lunch, Dinner","Heat oil; sauté chopped onions, tomatoes, and green chilies until soft; add spices, turmeric, and chopped tomatoes; cook until tomatoes soften; beat eggs and pour into the mixture, stirring continuously until eggs are scrambled and cooked; garnish with fresh coriander leaves and serve."
Egg Fried Rice,120,100,gm,"Rice, Eggs, Vegetables, Soy Sauce, Ginger, Garlic, Green Onions","Lunch, Dinner","Cook basmati rice until 70-80% done; cool and set aside; heat oil in a wok; sauté chopped vegetables (carrots, peas, bell peppers); add cooked rice to the vegetables; stir-fry; push the rice to the side; scramble eggs in the empty space; combine eggs with rice, add soy sauce, and toss until well-mixed; garnish with chopped green onions and serve hot."
Keema Biryani,150,100,gm,"Minced Meat, Basmati Rice, Yogurt, Onions, Tomatoes, Ghee, Biryani Masala","Lunch, Dinner","Cook minced meat with biryani rice, spices, and herbs for keema biryani."
Hyderabadi Haleem,150,1,cup,"Wheat, Meat (Lamb or Chicken), Lentils, Ghee, Spices",Dinner,"Slow-cook a mix of lentils, wheat, and barley with meat and spices for Hyderabadi haleem."
Chicken Reshmi Kebab,150,1,cup,"Chicken, Lentils, Wheat, Ghee, Spices",Dinner,"Marinate chicken in a mixture of cream, yogurt, and spices; grill for chicken reshmi kebab."
Tawa Pulao,150,1,cup,"Chicken, Basmati Rice, Onions, Tomatoes, Ginger, Garlic, Garam Masala",Dinner,Sauté cooked rice with vegetables and spices on a griddle for tawa pulao.
Chicken Chettinad,120,1,cup,"Chicken, Coconut Milk, Onions, Tomatoes, Ginger, Garlic, Garam Masala",Dinner,Prepare a spicy and flavorful chicken curry with Chettinad spices for chicken Chettinad.
Amritsari Fish,120,1,cup,"Fish, Gram Flour, Spices, Oil",Dinner,Marinate fish in a spiced gram flour batter; deep-fry for Amritsari fish.
Chicken Sukka,120,1,cup,"Chicken, Onions, Tomatoes, Coconut, Spices",Dinner,Cook chicken with spices and coconut for chicken sukka.
Nargisi Kofta,120,1,cup,"Minced Meat, Eggs, Onion, Tomato, Ginger, Garlic, Garam Masala",Dinner,Prepare deep-fried meatballs stuffed with boiled eggs for nargisi kofta.
Chicken Patiala,120,1,cup,"Chicken, Onions, Tomatoes, Cream, Ginger, Garlic, Garam Masala",Dinner,Cook chicken in a rich tomato-based curry for chicken Patiala.
Malai Kulfi,120,1,piece,"Milk, Cream, Sugar, Cardamom, Pistachios, Almonds",Dessert,"Make a creamy frozen dessert with milk, nuts, and saffron for malai kulfi."
Kadi Pakora,50,1,cup,"Yogurt, Gram Flour, Pakoras, Onions, Spices",Dinner,Cook yogurt-based curry with pakoras (gram flour fritters) for kadi pakora.
Chana Saag,150,1,cup,"Chickpeas, Spinach, Onions, Tomatoes, Ginger, Garlic, Garam Masala",Dinner,Cook chickpeas and spinach in a spiced gravy for chana saag.
Aloo Jeera,150,1,cup,"Potatoes, Cumin Seeds, Green Chilies, Coriander Leaves, Spices",Dinner,Sauté potatoes with cumin seeds for aloo jeera.
Lauki Kofta,250,1,cup,"Bottle Gourd, Gram Flour, Onions, Tomatoes, Spices",Dinner,Make dumplings with bottle gourd in a spiced curry for lauki kofta.
Mushroom Masala,150,1,cup,"Mushrooms, Onions, Tomatoes, Ginger, Garlic, Garam Masala",Dinner,Sauté mushrooms in a spiced onion-tomato gravy for mushroom masala.
Coconut Chutney,36,1,tablespoon,"Coconut, Green Chilies, Urad Dal, Chana Dal, Tamarind, Salt, Oil, Mustard Seeds, Curry Leaves",Side Dish,Blend coconut with green chilies and herbs for coconut chutney.
Avial,150,1,cup,"Mixed Vegetables (Carrot, Beans, Pumpkin, Drumstick), Coconut, Yogurt, Green Chilies, Cumin Seeds, Curry Leaves, Coconut Oil",Side Dish,Cook mixed vegetables in a coconut and yogurt-based gravy for avial.
Dahi Baingan,100,1,cup,"Eggplant, Yogurt, Mustard Seeds, Cumin Seeds, Asafoetida, Turmeric, Red Chili Powder, Coriander Leaves",Dinner,Prepare eggplant in a yogurt-based curry for dahi baingan.
Shahi Paneer,300,1,cup,"Paneer, Cashews, Onion, Tomato, Cream, Ghee, Ginger, Garlic, Green Chilies",Dinner,Make a rich and creamy paneer curry with cashew nuts for shahi paneer.
Papad Ki Sabzi,150,1,cup,"Papad, Mustard Seeds, Asafoetida, Turmeric, Red Chili Powder, Garam Masala, Coriander Leaves",Dinner,Slice papads into pieces and cook in a spiced yogurt-based curry for papad ki sabzi.
Methi Malai Murg,200,1,cup,"Chicken, Fresh Cream, Fenugreek Leaves, Cashews, Onion, Ginger, Garlic, Green Chilies",Dinner,Prepare a creamy chicken curry with fenugreek leaves for methi malai murg.
Lauki Chana Dal,150,1,glass,"Bottle Gourd, Chana Dal, Onion, Tomato, Ginger, Garlic, Turmeric, Cumin Seeds",Dinner,Cook bottle gourd with split chickpeas in a spiced gravy for lauki chana dal.
Mango Lassi,200,1,piece,"Mango, Yogurt, Sugar, Ice, Cardamom","Drink, Dessert","Blend ripe mangoes with yogurt, sugar, and cardamom for mango lassi."
Mysore Pak,100,1,piece,"Besan (Gram Flour), Ghee, Sugar, Cardamom",Dessert,"Make a rich and sweet South Indian dessert using gram flour, ghee, and sugar for mysore pak."
Kesar Peda,80,1,piece,"Khoya, Sugar, Saffron, Cardamom",Dessert,"Combine milk solids, saffron, and sugar for kesar peda."
Rajbhog,200,1,piece,"Cottage Cheese, Sugar Syrup, Saffron, Pistachios, Cashews",Dessert,Prepare a rich and decadent dessert with cottage cheese dumplings in sugar syrup for rajbhog.
Besan Ladoo,100,1,piece,"Gram Flour, Sugar, Ghee, Cardamom",Dessert,"Mix gram flour, ghee, and sugar to make sweet round balls for besan ladoo."
Kaju Katli,50,1,piece,"Cashews, Sugar, Ghee",Dessert,Make cashew nut fudge squares with sugar and ghee for kaju katli.
Imarti,150,1,piece,"Urad Dal, Sugar, Saffron, Cardamom",Dessert,"Fry spirals of fermented urad dal batter, soak in saffron-infused sugar syrup for imarti."
Gajar Ka Halwa,250,1,cup,"Carrots, Milk, Sugar, Ghee, Cardamom",Dessert,"Grate carrots and cook with milk, sugar, and ghee for gajar ka halwa."
Kesari,200,1,cup,"Semolina, Ghee, Sugar, Saffron, Cardamom",Dessert,"Cook semolina with ghee, sugar, and saffron for kesari."
Thandai,150,1,glass,"Milk, Sugar, Almonds, Saffron, Cardamom",Drink,"Blend almonds, fennel seeds, and cardamom-infused milk for thandai."
Poha,150,1,cup,"Flattened Rice, Mustard Seeds, Cumin Seeds, Peanuts, Curry Leaves, Green Chilies",Breakfast,"Cook flattened rice with spices, peas, and peanuts for poha"
Chai Latte,150,1,cup,"Tea Leaves, Milk, Sugar, Cardamom",Drink,"Boil 1 cup of water;

Add 1 black tea bag or 1 tablespoon loose tea leaves; simmer for about 5 minutes;

Reduce heat to low;

Add 1/2 tsp ground cinnamon, 1/4 tsp ground ginger, 1/4 tsp ground cardamom, a pinch of ground cloves, and a pinch of black pepper; stir well;

Pour in 1 cup of milk;

Stir and simmer until heated through;

Add 1-2 tablespoons sugar, adjusting to taste;

Strain the chai to remove tea leaves or bag;

Pour into a mug and enjoy!
"
Rajasthani Dal Baati,300,1,serving,"Wheat Flour, Ghee, Baking Powder",Dinner,Make a traditional Rajasthani dish with wheat balls (baati) and lentil curry for dal baati.
Litti Chokha,200,1,serving,"Wheat Flour, Gram Flour, Mustard Oil, Baking Soda",Dinner,Bake dough balls filled with roasted gram flour and spices; serve with mashed vegetables for litti chokha.
Jalebi Rabri,300,1,serving,"Wheat Flour, Gram Flour, Mustard Oil, Baking Soda",Dessert,Fry spirals of fermented wheat flour batter and soak them in saffron-infused sugar syrup; serve with condensed milk for jalebi rabri.
Kalaadi,150,1,piece,"Fermented Lentil and Rice Batter, Sugar Syrup",Snack,"Enjoy Kalaadi, a traditional cheese from Jammu & Kashmir, often pan-fried or grilled."
Patra,100,1,roll,"Gram Flour, Yogurt, Turmeric, Mustard Seeds, Curry Leaves",Snack,"Make colocasia leaves rolled with spiced gram flour paste, steamed, and then sliced for patra."
Fafda,50,1,piece,"Chickpea Flour, Yogurt, Ginger, Green Chilies, Coriander Leaves",Snack,"Fry gram flour sticks for fafda, a popular Gujarati snack."
Makki Ki Roti Sarson Saag,300,1,serving,"Cornmeal, Fenugreek Seeds, Buttermilk",Dinner,Prepare unleavened flatbreads made from cornmeal (makki) and served with mustard greens (sarson saag).
Khar,100,1,cup,"Chickpea Flour, Curd, Ginger, Green Chilies, Coriander Leaves",Dinner,"Prepare a traditional Assamese dish with raw papaya, pulses, and alkaline water for khar."
Undhiyu,250,1,cup,"Millet Flour, Water, Salt",Dinner,"Make a mixed vegetable curry, often with brinjal, green beans, and potatoes for undhiyu."
Til Chikki,50,1,piece,"Potatoes, Spices, Green Chutney, Tamarind Chutney",Dinner,Mix sesame seeds and jaggery to make til chikki.
Dal Dhokli,200,1,serving,"Chickpea Flour, Yogurt, Turmeric, Mustard Seeds, Sesame Seeds, Asafoetida",Dinner,"Combine wheat flour and spices, cut into diamond shapes, and cook in lentil soup for dal dhokli."
Khandvi,50,1,roll,"Cottage Cheese, Sugar, Cardamom",Snack,"Steam gram flour batter, roll into thin layers, and cut into rolls for khandvi."
Thepla,150,1,piece,"Coconut, Cilantro, Mustard Seeds, Green Chilies, Tamarind",Snack,"Make flatbreads with whole wheat flour, fenugreek, and spices for thepla."
Bhakri,100,1,piece,"Edible Gum, Wheat Flour, Ghee, Sugar",Dinner,Prepare unleavened bread made from millet or sorghum flour for bhakri.
Dabeli,300,1,serving,"Paneer, Onions, Tomatoes, Green Chilies, Ginger, Garlic, Spices",Snack,"Stuff pav (bun) with spiced mashed potatoes, peanuts, and pomegranate seeds for dabeli."
Khakra,50,1,piece,"Rice Flour, Black Gram Flour, Fenugreek Seeds",Snack,"Cook thin, crispy, unleavened bread made from gram flour for khakra."
Ras Malai,150,1,piece,"Jaggery, Gram Flour, Wheat Flour",Dessert,Make a dessert of cottage cheese dumplings in sweetened milk for ras malai.
Kothimbir Vadi,50,1,piece,"Gram Flour, Yogurt, Ginger, Green Chilies, Coriander Leaves",Snack,"Steam a mixture of gram flour, coriander, and spices, then slice and shallow-fry for kothimbir vadi."
Gond Ke Ladoo,100,1,cup,"Lentils, Wheat Flour, Ginger, Garlic, Green Chilies",Dessert,"Combine edible gum, whole wheat flour, ghee, and jaggery for gond ke ladoo."
Paneer Bhurji,200,1,cup,"Semolina, Yogurt, Baking Soda",Dinner,Scramble paneer (Indian cottage cheese) with spices for paneer bhurji.
Attu,80,1,piece,"Rice, Urad Dal, Chana Dal, Fenugreek Seeds, Water",Breakfast,Prepare a savory dosa-like dish made from fermented rice and urad dal for attu.
Puran Poli,150,1,piece,"Chana Dal, Jaggery, Cardamom, Maida (All-Purpose Flour), Ghee",Dessert,Make sweet flatbreads filled with sweetened lentil paste for puran poli.
Sev Tameta Nu Shaak,100,1,piece,"Sev, Tomatoes, Garlic, Mustard Seeds, Cumin Seeds, Asafoetida",Dinner,Cook a spicy tomato and gram flour-based curry for sev tameta nu shaak.
Dhansak,200,1,cup,"Lentils, Mixed Vegetables, Tamarind, Coconut, Spices",Dinner,"Prepare a Parsi dish with meat, lentils, and vegetables for dhansak."
Khaman Dhokla,50,1,piece,"Lentil Flour, Yogurt, Baking Soda, Mustard Seeds, Curry Leaves, Green Chilies",Snack,Steam a fermented batter made from rice and chickpea flour for khaman dhokla.
Shrikhand,250,1,cup,"Yogurt, Sugar, Cardamom, Saffron, Almonds, Pistachios",Dessert,"Combine strained yogurt with sugar, saffron, and cardamom for shrikhand."
Dhokli,150,1,serving,"Wheat Flour, Gram Flour, Tuvar Dal, Tamarind, Jaggery, Mustard Seeds",Dinner,Prepare dhokli by rolling out dough into thin discs and boiling them in a lentil-based soup.
Veg Momos,50,1,piece,"Steamed Flour Dumplings, Mixed Vegetables, Soy Sauce, Ginger, Garlic, Green Chilies",Snack,Steam or fry vegetable-filled dumplings for veg momos.
Kesar Elaichi Srikhand,200,1,cup,"Yogurt, Sugar, Saffron, Cardamom",Dessert,Infuse strained yogurt with saffron and cardamom for kesar elaichi srikhand.
Muthia,50,1,piece,"Gram Flour, Methi (Fenugreek) Leaves, Sesame Seeds, Mustard Seeds, Asafoetida",Snack,Mix grated vegetables with chickpea flour and spices; steam or fry into cylindrical shapes for muthia.
Muthiya,50,1,piece,"Flour, Cilantro, Spinach, Gram Flour, Sesame Seeds, Turmeric, Salt",Snack,Prepare muthiya by steaming or frying dumplings made from a mixture of grated vegetables and spices.
Masala Puri,150,1,serving,"Puri, Boiled Potatoes, Masala, Tamarind Chutney, Sev, Coriander, Onion",Snack,"Crushed puris mixed with spicy masala, boiled potatoes, and chutneys make masala puri."
Chaat,200,1,plate,"Potatoes, Chickpeas, Yogurt, Tamarind Chutney, Sev, Chaat Masala, Coriander",Snack,"Combine various ingredients such as potatoes, chickpeas, yogurt, and chutneys for chaat."
Hamburger,250,1,sandwich,"Beef Patty, Burger Bun, Lettuce, Tomato, Onion, Ketchup",Dinner,"Grill or cook a hamburger patty, place it in a bun, and add desired toppings."
Pizza,300,1,slice,"Pizza Dough, Tomato Sauce, Cheese, Pepperoni, Herbs, Olive Oil",Dinner,"Top a pizza dough with tomato sauce, cheese, and your favorite toppings; bake until golden."
Grilled Chicken Salad,150,1,serving,"Chicken Breast, Lettuce, Tomatoes, Cucumber, Olive Oil, Balsamic Vinegar","Lunch, Dinner",Grill chicken and place it over a bed of mixed greens for a grilled chicken salad.
Apple Pie,300,1,slice,"Apples, Sugar, Cinnamon, Pie Crust, Butter, Lemon Juice","Dessert, Snack",Bake apples in a pie crust with sugar and spices for apple pie.
Cheeseburger,300,1,sandwich,"Beef Patty, Burger Bun, Cheese, Lettuce, Tomato, Ketchup",Dinner,"Grill or cook a cheeseburger patty, place it in a bun, and add desired toppings."
Coca-Cola,140,1,can,"Carbonated Water, High Fructose Corn Syrup, Caramel Color, Phosphoric Acid, Natural Flavors, Caffeine",Drink,Enjoy a classic carbonated beverage like Coca-Cola.
Pasta,200,1,cup,"Spaghetti, Tomato Sauce, Garlic, Olive Oil, Basil, Parmesan Cheese",Dinner,Boil pasta until al dente; toss with your favorite sauce and toppings.
Hot Dog,150,1,piece,"Hot Dog Bun, Sausage, Ketchup, Mustard, Relish, Onions","Snack, Dinner",Grill or boil hot dogs; place in buns; add desired toppings.
Chocolate Chip Cookies,50,1,cookie,"Chocolate Chips, Butter, Flour, Sugar, Eggs, Vanilla Extract","Dessert, Snack",Mix cookie dough with chocolate chips; drop spoonfuls onto a baking sheet; bake until golden brown for chocolate chip cookies.
Chicken Wings,480,6,wings,"Chicken Wings, Hot Sauce, Butter, Celery Sticks, Blue Cheese Dressing, Garlic Powder","Snack, Dinner",Bake or fry chicken wings; toss in your favorite sauce.
Buffalo Chicken Wrap,400,1,wrap,"Chicken Breast, Flour Tortilla, Lettuce, Tomatoes, Ranch Dressing, Buffalo Sauce","Lunch, Dinner","Grill or cook chicken; toss with buffalo sauce; place in a wrap with lettuce, tomato, and ranch dressing for a buffalo chicken wrap."
Caesar Salad,250,1,serving,"Romaine Lettuce, Croutons, Parmesan Cheese, Caesar Dressing, Lemon, Black Pepper","Breakfast,","Toss chopped romaine lettuce with Caesar dressing, croutons, and Parmesan cheese for a Caesar salad."
Burrito Bowl,500,1,serving,"Rice, Black Beans, Chicken, Salsa, Guacamole, Sour Cream","Lunch, Dinner","Layer rice, beans, grilled chicken or beef, and assorted toppings in a bowl for a burrito bowl."
Sushi Roll,200,1,roll,"Nori, Rice, Fish (Salmon, Tuna), Avocado, Cucumber, Soy Sauce",Dinner,"Roll sushi rice, seaweed, and your choice of fillings into a sushi roll."
Club Sandwich,500,1,sandwich,"Turkey, Bacon, Lettuce, Tomato, Mayonnaise, Bread","Lunch, Dinner","Stack layers of turkey, bacon, lettuce, tomato, and mayo between slices of bread for a club sandwich."
Pancakes,300,3,pancakes,"Flour, Baking Powder, Eggs, Milk, Butter, Maple Syrup",Breakfast,Cook pancakes on a griddle; serve with syrup and your favorite toppings.
Waffles,250,2,waffles,"Waffle Batter, Maple Syrup, Butter, Fruit (optional)",Breakfast,"Cook waffles in a waffle iron; top with whipped cream, fruit, and syrup."
Bacon And Egg Sandwich,450,1,sandwich,"Bacon, Eggs, Bread","Breakfast, Snack",Cook bacon until crispy; fry or scramble eggs; place between slices of bread for a bacon and egg sandwich.
Subway Turkey Breast Sandwich,350,1,6pieceinch,"Turkey Breast, Bread, Lettuce, Tomato, Mayonnaise, Mustard","Lunch, Dinner",Assemble a Subway turkey breast sandwich with your favorite toppings and condiments.
Blt Sandwich,450,1,sandwich,"Bacon, Lettuce, Tomato, Bread, Mayonnaise","Lunch, Dinner","Stack layers of bacon, lettuce, and tomato between slices of bread for a BLT sandwich."
Chicken Quesadilla,450,1,serving,"Chicken, Cheese, Flour Tortilla, Peppers, Onions, Salsa","Lunch, Dinner","Fill a tortilla with cooked chicken, cheese, and vegetables; fold and cook for a chicken quesadilla."
Shrimp Scampi,400,1,serving,"Shrimp, Linguine Pasta, Garlic, Lemon, Butter, Parsley",Dinner,Sauté shrimp in garlic and butter; toss with pasta and parsley for shrimp scampi.
Chicken Caesar Wrap,350,1,wrap,"Chicken Breast, Romaine Lettuce, Caesar Dressing, Flour Tortilla, Parmesan Cheese","Lunch, Dinner",Toss grilled chicken with chopped romaine lettuce; drizzle Caesar dressing over the mixture; sprinkle with grated Parmesan cheese; spoon onto a wrap and fold for a chicken Caesar wrap.
Taco Salad,400,1,serving,"Taco Shell, Lettuce, Tomatoes, Cheese, Ground Beef, Salsa","Lunch, Dinner","Brown ground beef with taco seasoning; place over a bed of lettuce; top with tomatoes, cheese, salsa, and sour cream for taco salad."
Chili Cheese Fries,600,1,serving,"French Fries, Chili, Cheese Sauce","Snack, Dinner",Prepare chili; pour over a bed of crispy fries; top with shredded cheese for chili cheese fries.
Cheese Fries,400,1,serving,"French Fries, Cheese Sauce","Snack, Dinner",Arrange crispy fries on a tray; melt cheese over the fries for cheese fries.
Fish Tacos,300,2,tacos,"Tortillas, Fish Fillets, Cabbage Slaw, Avocado, Lime, Chipotle Sauce",Dinner,"Grill or fry fish; place in tortillas; top with cabbage, salsa, and a squeeze of lime for fish tacos."
Onion Rings,400,1,serving,"Onions, Flour, Buttermilk, Salt, Pepper, Vegetable Oil","Snack, Dinner",Coat onion rings in seasoned flour; deep-fry until golden brown.
Mozzarella Sticks,350,6,sticks,"Mozzarella Cheese, Bread Crumbs, Eggs, Marinara Sauce","Snack, Dinner",Coat mozzarella sticks in breadcrumbs; bake or fry until golden and gooey.
Chicken Tenders,400,4,tenders,"Chicken Tenders, Flour, Eggs, Bread Crumbs, Salt, Pepper","Snack, Dinner","Coat chicken tenders in seasoned flour; dip in beaten eggs, coat with breadcrumbs; bake or fry until golden brown."
Bbq Ribs,300,1,serving,"Pork Ribs, BBQ Sauce, Salt, Pepper, Paprika, Garlic Powder",Dinner,Rub BBQ seasoning on ribs; slow-cook or grill until tender; baste with BBQ sauce.
Meatball Sub,400,1,sandwich,"Meatballs, Marinara Sauce, Sub Roll, Mozzarella Cheese, Parmesan Cheese, Basil",Dinner,Cook meatballs; simmer in tomato sauce; place in a sub roll; top with cheese and bake until melted for a meatball sub.
Vegetarian Burrito,500,1,serving,"Rice, Black Beans, Corn, Salsa, Avocado, Tortilla","Lunch, Dinner","Sauté vegetables (bell peppers, onions, beans); add rice, salsa, and guacamole; wrap in a tortilla for a vegetarian burrito."
Nachos With Cheese,400,1,serving,"Tortilla Chips, Cheese Sauce, Sour Cream, Guacamole, Salsa, Jalapeños","Snack, Dinner","Arrange tortilla chips on a tray; melt cheese over the chips; top with salsa, guacamole, and sour cream for nachos."
Soft Pretzel,500,1,pretzel,"Flour, Yeast, Baking Soda, Salt, Water, Butter","Snack, Dinner",Boil pretzels in water with baking soda; bake until golden brown; sprinkle with salt.
Chicken Alfredo Pasta,300,1,serving,"Fettuccine Pasta, Chicken, Alfredo Sauce, Garlic, Parmesan Cheese, Parsley",Dinner,Cook chicken; mix with Alfredo sauce and cooked pasta.
Philly Cheesesteak Sandwich,600,1,sandwich,"Beef Steak, Rolls, Onion, Bell Peppers, Provolone Cheese, Mayonnaise",Dinner,Sauté thinly sliced beef with onions and bell peppers; place in a sub roll; top with melted cheese.
Grilled Cheese Sandwich,500,1,sandwich,"Bread, Cheese, Butter","Snack, Dinner",Butter one side of bread slices; place cheese between slices; grill until golden brown.
Doughnut,350,1,doughnut,"Flour, Sugar, Eggs, Milk, Vanilla Extract, Baking Powder","Dessert, Snack",Fry or bake doughnuts; glaze with icing or coat in cinnamon sugar.
Ice Cream Cone,250,1,cone,"Ice Cream, Cone","Dessert, Snack",Scoop ice cream into a cone; top with sprinkles or chocolate sauce.
