FoodItem,calories,amount,unit,ingrediant,meal_time,recepie
Cheesecake,200,1,slice,"Cream Cheese, Sugar, Eggs, Sour Cream, Vanilla Extract, Graham Cracker Crust","Dessert, Snack","Mix cream cheese, sugar, and vanilla for cheesecake filling; pour over a graham cracker crust; refrigerate until set."
Cupcake,300,1,cupcake,"Flour, Sugar, Eggs, Milk, Vanilla Extract, Baking Powder","Dessert, Snack",Bake cupcakes; frost with icing and decorate as desired.
Peanut Butter And Jelly Sandwich,200,1,sandwich,"Peanut Butter, Jelly, Bread","Snack, Lunch",Spread peanut butter on one slice of bread; spread jelly or jam on the other slice; press the slices together.
Smoothie,140,1,cup,"Fruit, Yogurt, Milk, Honey, Ice, Blender","Snack, Breakfast, Drink","Blend frozen mixed berries, banana, yogurt, and milk until smooth; sweeten with honey to taste."
Chicken Nuggets,400,6,pieces,"Chicken, Breadcrumbs, Flour, Eggs, Salt, Pepper","Snack, Lunch, Dinner","Coat chicken pieces in flour, dip in beaten eggs, coat with bread crumbs; bake until golden brown and cooked through."
Mushroom Swiss Burger,400,1,burger,"Mushrooms, Swiss Cheese, Beef Patty, Burger Bun, Lettuce, Tomato",Dinner,"Form ground beef into patties; season with salt and pepper; cook patties, sauté mushrooms, place on top of burgers; add Swiss cheese slices; serve in burger buns."
Bbq Pulled Pork Sandwich,450,1,sandwich,"Pork Shoulder, BBQ Sauce, Rolls, Coleslaw","Lunch, Dinner",Heat pulled pork with BBQ sauce; pile onto burger buns; top with coleslaw if desired.
Chow Mein,350,1,serving,"Noodles, Bean Sprouts, Carrots, Celery, Chicken, Soy Sauce",Dinner,"Cook egg noodles; stir-fry chicken or beef with garlic and ginger; add vegetables, cook until tender; toss in noodles and soy sauce."
Egg Roll,200,1,roll,"Cabbage, Carrots, Pork, Soy Sauce, Garlic, Ginger","Snack, Dinner","Cook ground meat until browned; add shredded cabbage, carrots, soy sauce, and sesame oil; place filling in egg roll wrappers and fry until golden brown."
General Tso'S Chicken,400,1,serving,"Chicken, Soy Sauce, Rice Vinegar, Sugar, Ginger, Garlic",Dinner,"Coat chicken in cornstarch and fry until crispy; mix soy sauce, ginger, garlic, sugar, vinegar, and red pepper flakes in a separate pan; add chicken and coat in the sauce."
Mongolian Beef,350,1,serving,"Beef, Soy Sauce, Brown Sugar, Ginger, Garlic, Green Onions",Dinner,"Sauté beef until browned; mix soy sauce, brown sugar, garlic, and ginger in a sauce; add the sauce to the beef and cook until thickened; top with sliced green onions."
Orange Chicken,300,1,serving,"Chicken, Orange Juice, Soy Sauce, Brown Sugar, Ginger, Garlic",Dinner,"Cook chicken until browned; mix orange juice, zest, soy sauce, brown sugar, and cornstarch in a sauce; add the sauce to the chicken and cook until thickened."
Spaghetti And Meatballs,500,1,serving,"Spaghetti, Ground Beef, Tomato Sauce, Garlic, Parmesan Cheese, Italian Seasoning",Dinner,"Cook spaghetti; mix ground meat with bread crumbs, egg, and milk; form into meatballs; cook meatballs, simmer in tomato sauce; serve over spaghetti, top with Parmesan cheese."
Clam Chowder,250,1,cup,"Clams, Potatoes, Bacon, Onion, Celery, Cream","Dinner, Soup","Cook bacon until crispy; sauté onion, celery, and garlic in bacon fat; add diced potatoes, clams, and chicken broth; simmer until potatoes are tender; stir in heavy cream, season to taste; garnish with crumbled bacon."
Caesar Wrap,350,1,wrap,"Chicken, Romaine Lettuce, Caesar Dressing, Parmesan Cheese, Tortilla, Croutons","Lunch, Dinner",Toss grilled chicken with chopped romaine lettuce; drizzle Caesar dressing over the mixture; sprinkle with grated Parmesan cheese; spoon onto flour tortillas and wrap.
Tuna Sandwich,450,1,sandwich,"Tuna, Bread, Mayonnaise, Celery, Onion, Lettuce","Lunch, Dinner","Mix canned tuna with mayonnaise, diced celery, and season with salt and pepper. Spread the tuna mixture on bread slices, add lettuce, and assemble into a sandwich."
Chicken Burrito,400,1,serving,"Chicken, Rice, Black Beans, Salsa, Cheese, Tortilla","Lunch, Dinner","Cook seasoned chicken strips in a pan until fully cooked. Assemble the burrito with cooked rice, black beans, chicken, salsa, cheese, and sour cream."
Chicken Caesar Salad,300,1,serving,"Chicken, Romaine Lettuce, Caesar Dressing, Parmesan Cheese, Croutons, Cherry Tomatoes","Lunch, Dinner","Toss grilled chicken strips with romaine lettuce, Caesar dressing, croutons, and Parmesan cheese."
Turkey Club Sandwich,500,1,sandwich,"Turkey, Bacon, Lettuce, Tomato, Mayonnaise, Bread","Lunch, Dinner","Layer turkey slices, bacon, lettuce, tomato, and mayonnaise between three slices of toasted bread."
Baked Ziti,400,1,serving,"Ziti Pasta, Tomato Sauce, Ricotta Cheese, Mozzarella Cheese, Parmesan Cheese, Ground Beef",Dinner,"Cook ziti pasta; layer with marinara sauce, ricotta, and mozzarella cheese; bake until bubbly."
Shrimp Po' Boy Sandwich,450,1,sandwich,"Shrimp, French Bread, Lettuce, Tomato, Remoulade Sauce, Pickles",Dinner,"Coat shrimp in seasoned flour, fry until golden; assemble in a sandwich with lettuce and remoulade sauce."
Chicken Fajitas,350,1,serving,"Chicken, Bell Peppers, Onion, Fajita Seasoning, Tortilla, Sour Cream",Dinner,Saute sliced chicken with bell peppers and onions; serve in tortillas with salsa and guacamole.
Spinach And Artichoke Dip,400,1,serving,"Spinach, Artichoke Hearts, Cream Cheese, Sour Cream, Parmesan Cheese, Garlic","Dinner, Snack","Mix cream cheese, mayonnaise, spinach, artichokes, and Parmesan cheese; bake until hot and bubbly."
Shrimp And Grits,450,1,serving,"Shrimp, Grits, Andouille Sausage, Bell Peppers, Onion, Garlic",Dinner,Cook shrimp in a savory sauce with garlic and Cajun spices; serve over creamy grits.
Pumpkin Pie,300,1,slice,"Pumpkin Puree, Pie Crust, Sugar, Cinnamon, Nutmeg, Eggs","Dessert, Snack","Mix pumpkin puree, eggs, sugar, and spices; pour into a pie crust; bake until set."
Cranberry Sauce,50,1,serving,"Cranberries, Sugar, Water, Orange Zest, Cinnamon, Orange Juice","Side Dish, Snack",Boil cranberries with sugar and water until they burst; chill before serving.
Green Bean Casserole,150,1,serving,"Green Beans, Cream of Mushroom Soup, Fried Onions, Milk, Salt, Pepper","Side Dish, Dinner","Mix green beans with cream of mushroom soup, onions, and fried onions; bake until bubbly."
Macaroni And Cheese,300,1,cup,"Elbow Macaroni, Cheddar Cheese, Milk, Butter, All-Purpose Flour, Mustard Powder","Side Dish, Dinner","Cook macaroni; make a cheese sauce with butter, flour, milk, and cheese; combine and bake."
Sweet Potato Casserole,200,1,serving,"Sweet Potatoes, Brown Sugar, Eggs, Vanilla Extract, Butter, Pecans (topping)","Side Dish, Dinner","Mash sweet potatoes; mix with sugar, butter, eggs, and vanilla; top with pecans and bake."
Cornbread,150,1,piece,"Cornmeal, Flour, Baking Powder, Milk, Eggs, Butter","Side Dish, Snack","Bake a savory cornbread with cornmeal, flour, buttermilk, and baking powder."
Beef Stroganoff,400,1,serving,"Beef Strips, Mushrooms, Onion, Sour Cream, Beef Broth, Egg Noodles",Dinner,Cook beef in a creamy mushroom sauce; serve over noodles or rice.
Chicken Pot Pie,350,1,serving,"Chicken, Carrots, Peas, Potatoes, Puff Pastry, Chicken Broth",Dinner,"Make a savory filling with chicken, veggies, and broth; bake with a pie crust until golden."
Chicken And Dumplings,300,1,serving,"Chicken, Flour, Baking Powder, Milk, Butter, Chicken Broth",Dinner,"Cook chicken with vegetables in broth; make dumplings with flour, baking powder, and milk; drop into simmering broth until cooked through."
Meatloaf,250,1,slice,"Ground Beef, Bread Crumbs, Onion, Milk, Eggs, Ketchup (topping)",Dinner,"Mix ground beef, breadcrumbs, eggs, and seasonings; shape into a loaf; bake until cooked through."
Potato Salad,200,1,cup,"Potatoes, Mayonnaise, Mustard, Pickles, Hard-Boiled Eggs, Celery","Lunch, Dinner","Boil potatoes until tender; mix with mayo, mustard, and seasonings; chill before serving."
Coleslaw,150,1,cup,"Cabbage, Carrots, Mayonnaise, Vinegar, Sugar, Celery Seed","Lunch, Dinner, Snack","Shred cabbage and carrots; mix with mayo, vinegar, sugar, and seasonings; refrigerate until cold."
Buffalo Wings,500,6,wings,"Chicken Wings, Hot Sauce, Butter, Celery Sticks, Blue Cheese Dressing, All-Purpose Flour","Lunch, Dinner, Snack",Deep-fry chicken wings until crispy; toss in buffalo sauce made from hot sauce and butter.
Cajun Shrimp Pasta,450,1,serving,"Shrimp, Pasta, Cajun Seasoning, Butter, Heavy Cream, Garlic",Dinner,"Cook shrimp in Cajun seasoning, garlic, and cream; toss with cooked pasta."
Shrimp And Crab Boil,400,1,serving,"Shrimp, Crab, Corn on the Cob, Potatoes, Cajun Seasoning, Lemon",Dinner,"Boil shrimp, crab, potatoes, corn, and seasonings; drain and serve."
Lobster Roll,450,1,sandwich,"Lobster Meat, Mayonnaise, Celery, Lemon Juice, Butter, Hot Dog Bun","Lunch, Dinner",Fill a split-top bun with lobster meat; serve with melted butter and lemon.
New York Cheesecake,350,1,slice,"Cream Cheese, Sugar, Eggs, Sour Cream, Vanilla Extract, Graham Cracker Crust","Snack, Dessert","Mix cream cheese, sugar, and vanilla; pour into a graham cracker crust; chill until set."
Bagel With Cream Cheese,300,1,bagel,"Bagel, Cream Cheese, Smoked Salmon (optional), Red Onion (optional), Capers (optional), Dill (optional)","Breakfast, Snack","Spread cream cheese on a bagel; serve with smoked salmon, capers, and red onion."
Blueberry Pancakes,300,3,pancakes,"Pancake Mix, Blueberries, Milk, Eggs, Butter, Maple Syrup",Breakfast,"Make a batter with flour, sugar, baking powder, and blueberries; cook on a griddle until golden brown."
French Toast,250,2,slices,"Bread, Eggs, Milk, Cinnamon, Vanilla Extract, Butter",Breakfast,"Whisk together eggs, milk, and cinnamon; dip bread slices into the mixture; cook on a griddle until golden brown; serve with maple syrup."
Monte Cristo Sandwich,500,1,sandwich,"Ham, Turkey, Swiss Cheese, Bread, Eggs, Milk","Lunch, Dinner","Layer ham, turkey, and Swiss cheese between bread slices; dip in beaten eggs; grill until golden brown; dust with powdered sugar; serve with jam."
Cinnamon Roll,350,1,roll,"Flour, Sugar, Cinnamon, Butter, Yeast, Cream Cheese (for frosting)","Breakfast, Snack, Dessert","Roll out prepared dough into a rectangle; spread sugar and cinnamon mixture; roll, cut, and bake until golden; top with cream cheese frosting."
Caramel Popcorn,150,1,cup,"Popcorn, Butter, Brown Sugar, Corn Syrup, Baking Soda, Vanilla Extract","Snack, Dessert","Popcorn coated with caramel sauce made from sugar, butter, and corn syrup; bake until crispy."
Garlic Bread,100,1,piece,"Bread, Butter, Garlic, Parsley, Olive Oil","Dinner, Snack",Mix softened butter with minced garlic and chopped parsley; spread on bread slices; toast until golden brown.
Biscuits And Gravy,300,1,serving,"Biscuits, Sausage, Milk, Flour, Salt, Pepper",Breakfast,"Make biscuits; cook sausage; make gravy with flour, milk, and sausage; serve over biscuits."
Fried Catfish,250,1,fillet,"Catfish fillets, Cornmeal, Flour, Salt, Pepper, Cooking Oil",Dinner,Dip catfish fillets in seasoned flour; fry until golden brown; serve with lemon wedges.
Hushpuppies,200,6,pieces,"Cornmeal, Flour, Baking Powder, Salt, Onion, Buttermilk","Snack, Dinner","Mix cornmeal, flour, and seasonings; drop spoonfuls into hot oil; fry until golden brown."
Country Fried Steak,400,1,serving,"Beef Steak, Flour, Eggs, Milk, Salt, Pepper",Dinner,"Bread and fry steak cutlets; make creamy gravy with flour, milk, and drippings; serve over steak."
Corned Beef Hash,350,1,cup,"Corned Beef, Potatoes, Onion, Butter, Salt, Pepper","Breakfast, Lunch","Mix corned beef, potatoes, and onions; cook until crispy; serve with eggs."
Reuben Sandwich,500,1,sandwich,"Corned Beef, Swiss Cheese, Sauerkraut, Rye Bread, Thousand Island Dressing, Butter","Lunch, Dinner","Layer corned beef, sauerkraut, Swiss cheese, and Russian dressing between rye bread slices; grill until heated through."
Noodles,221,1,serving,"Noodle,Spices,Flour,Onion","Dinner,Snack","Boil the noodles according to the package instructions until al dente; drain and rinse under cold water;

In a small bowl, mix soy sauce, oyster sauce, sesame oil, sugar, and black pepper; adjust seasoning to taste;

Heat vegetable oil in a large wok or skillet over medium-high heat;

Add minced garlic and ginger; stir-fry for about 30 seconds until fragrant;

Add thinly sliced mixed vegetables to the wok and stir-fry for 2-3 minutes until slightly tender;

Add the cooked noodles to the wok and pour the prepared sauce over them;

Toss everything together using tongs or chopsticks until the noodles are evenly coated with the sauce;

Continue to stir-fry for an additional 2-3 minutes, allowing flavors to meld and noodles to absorb the sauce;

Taste and adjust seasoning if needed;

Transfer stir-fried noodles to a serving platter;

Garnish with optional toppings like sliced green onions, sesame seeds, and crushed red pepper flakes;

Serve and enjoy your homemade stir-fried noodles; you can also add protein such as chicken, shrimp, tofu, or beef if desired."
